actor,movie_or_TV_name
John Colicos,"Battlestar Galactica: The Second Coming,My Father's Shadow: The Sam Sheppard Story,Star Trek: Deep Space Nine,Once More Unto The Breach,The Sword Of Kahless,Blood Oath,Thunder Point,Jack Higgins's the Windsor Protocol,Fast Track,Fathers & Sons,The Last Don,Part II,X-Men: The Animated Series,Beyond Good and Evil: Part 4,Beyond Good and Evil: Part 3,Beyond Good and Evil: Part 2,Beyond Good and Evil: Part 1,Sanctuary: Part 2,Show all 22 episodes,No Contest,Counterstrike,The Contender,Beyond Reality,Bloodstone,E.N.G.,Smoke and Mirrors,In Defense of a Married Man,Love and Hate,War of the Worlds,My Soul to Keep,The Prodigal Son,Alfred Hitchcock Presents,My Dear Watson,Deathmate,Shadow Dancing,Night Heat,Blowing Bubbles,The Victim,Nowhere to Hide,I'll Take Manhattan,Episode #1.2,Episode #1.1,Street Legal,A Little Knowledge,The Last Season,The Hitchhiker,Petty Thieves,Scarecrow and Mrs. King,Playing Possum,The Yellow Rose,Sport of Kings,General Hospital,Episode dated 18 September 1981,Episode #1.4715,Episode #1.4714,Episode dated 28 August 1981,Episode dated 27 August 1981,Show all 8 episodes,The Postman Always Rings Twice,Phobia,The Changeling,Vega$,Dan Tanna Is Dead,The Paradise Connection,King Solomon's Treasure,Battlestar Galactica,The Hand of God,Take the Celestra,Experiment in Terra,Baltar's Escape,Greetings from Earth,Show all 21 episodes,Charlie's Angels,Angel in a Box,Sergeant T.K. Yu,The Hardy Boys/Nancy Drew Mysteries,Search for Atlantis,W.E.B.,The Girl Who Saved Our America: Part 2,The Girl Who Saved Our America: Part 1,Battlestar Galactica,The Bastard,The Six Million Dollar Man,The Moving Mountain,Quincy M.E.,Gone But Not Forgotten,Switch,Coronado Circle,Wonder Woman,The Queen and the Thief,Drum,Breaking Point,Medical Center,You Can't Annul My Baby,Heel of the Tyrant,The Magical World of Disney,The Whiz Kid and the Carnival Caper: Part 2,The Whiz Kid and the Carnival Caper: Part 1,The Whiz Kid and the Carnival Caper,Harry O,The Madonna Legacy,Petrocelli,Terror on Wheels,Bronk,Terror,Hawaii Five-O,Death's Name Is Sam,The One with the Gun,A Matter of Wife... and Death,Insight,The Pendulum,Performance,The Trial of Sinyavsky and Daniel,Find Volopchi!,Gunsmoke,Hard Labor,Police Surgeon,Requiem for an Animal,Night Watch,The National Dream: Building the Impossible Railway,The Last Spike,The Desperate Days,The Railway General,Salty,For the Price of Freedom,The Lives of Benjamin Franklin,The Ambassador,The Magician,The Illusion of the Curious Counterfeit: Part II,The Illusion of the Curious Counterfeit: Part I,Mannix,Race Against Time: Part 2,Race Against Time: Part 1,The Inside Man,Cry Pigeon,A Day Filled with Shadows,Show all 7 episodes,The Starlost,The Goddess Calabra,Portrait: A Man Whose Name Was John,Scorpio,The Wrath of God,The F.B.I.,The Test,Longstreet,Sad Songs and Other Conversations,Goodbye, Raggedy Ann,Red Sky at Morning,Raid on Rommel,Doctors' Wives,Night Gallery,Pamela's Voice/Lone Survivor/The Doll,Mission: Impossible,Flight,The Play,The Reluctant Dragon,The Young Rebels,The Blood of an Englishman,It Takes a Thief,Project ""X"",Then Came Bronson,Still Waters,The High Chaparral,The Journal of Death,Anne of the Thousand Days,The Name of the Game,High Card,Dulcima,Star Trek,Errand of Mercy,T.H.E. Cat,A Slight Family Trait,Armchair Mystery Theatre,Licence to Murder,Profiles in Courage,Thomas Corwin,George Mason,The Defenders,The Merry-Go-Round Mender,The Silent Killer,Deadline for Murder,Playdate,The Critic,The Queen of Spades,The Troubled Heart,Festival,Galileo,The Wild Duck,Ivan,Lord Arthur Savile's Crime,The United States Steel Hour,The Troubled Heart,The Case of the Missing Wife,The Imposter,Cyrano De Bergerac,John Brown's Body,The Man Born to Be King,Vanity Fair,Part 1,Our American Heritage,Born a Giant,Not Without Honor,Family Classics: The Three Musketeers,Omnibus,He Shall Have Power,Sunday Showcase,Our American Heritage: Not Without Honor,Encounter,The Virtuous Island,The New Men,Rosmersholm,Operation North Star,Play of the Week,Mary Stuart,The DuPont Show of the Month,Treasure Island,Oliver Twist,The Count of Monte Cristo,Wuthering Heights,Startime,A Clearing in the Woods,The Unforeseen,Checkmate,Berkeley Square,Folio,Ward No. Six,Studio One,The Rice Sprout Song,War Drums,The Adventures of Hiram Holliday,Lapidary Wheel,You Are There,Mr. Christian Seizes the Bounty (April 28, 1789),Breakaway,Passport to Treason,Bond of Fear,The Taming of the Shrew,London Playhouse,Adeline Girard,Murder on Approval,The Secret Storm,Playbill,Lord Arthur Savile's Crime,Rheingold Theatre,The Heel,BBC Sunday-Night Theatre,Will Shakespeare,Captain Brassbound's Conversion,Raiders in the Sky,Forbidden Journey,Star Trek: Deep Space Nine,Blood Oath,What We Left Behind: Star Trek DS9,American Caesar,Episode dated 4 March 1985,Episode dated 3 March 1985,Laughter in My Soul,The 5th Annual People's Choice Awards,The Hecklers,Tennessee Williams' South,Omnibus,The Wit & World of George Bernard Shaw,A Choice of Futures,Les ludions,What We Left Behind: Star Trek DS9,Glen Larson on the Creation of 'Battlestar Galactica',Remembering 'Battlestar Galactica',Conquest of the Earth,The Starlost: The Beginning,Mission Galactica: The Cylon Attack"
Lawrence Pressman,"The Guardian Angel,announced,Snowbird,pre-production,Saving Paradise,Growth,Better Things,Batceañera,Hawaii Five-0,He puhe'e miki,9-1-1,Buck, Actually,Modern Family,The Escape,Break a Hip,The Surprise,The Pool,The Millionaire,Totem,Doubt,Clean Burn,Hart of Dixie,Bluebell,End of Days,Second Chance,Stuck,One More Last Chance,Show all 7 episodes,Transparent,Looking Up,Wedge,Why Do We Cover the Mirrors?,The Letting Go,Pilot,Show all 6 episodes,Beyond the Heavens,Lily Look Here,Law & Order: LA,El Sereno,Mad Men,Tomorrowland,Hawthorne,Final Curtain,Gamechangers Ep. 3: A Legend in the Booth,Criminal Minds,Reckoner,Mother and Child,Tickling Leo,Saving Grace,Am I Going to Lose Her?,The Mentalist,Red Brick and Ivy,Boston Legal,The Mighty Rogues,Son of the Defender,Ghost Whisperer,First Do No Harm,Cold Case,World's End,General Hospital,Episode #1.11367,Episode #1.11366,Episode #1.11365,Episode #1.11364,Episode #1.11363,Show all 12 episodes,Crossing Jordan,Post Hoc...,The Elephant in the Room,Locard's Exchange,Slam Dunk,NCIS,Driven,Yankee White,The Far Side of Jericho,Just Legal,The Bar,Mentor,American Dreamz,Bones,The Woman in the Car,Medium,When Push Comes to Shove: Part 2,Pilot,Fathers and Sons,Nine Lives,Jack & Bobby,Valentino,Murder Without Conviction,Century City,Sweet Child of Mine,Gilmore Girls,Tick, Tick, Tick, Boom!,Nag Hammadi Is Where They Found the Gnostic Gospel,Judging Amy,Werewolves of Hartford,Redheaded Stepchild,Crowded House,The Persistence of Tectonics,Witch Hunt,DC 9/11: Time of Crisis,American Wedding,Without a Trace,There Goes the Bride,Mister Sterling,Human Error,The Guardian,The Beginning,Home,Reunion,The Practice,The Return of Joey Heric,Infected,The Agency,Closure,The Hughleys,Mid-Wife Crisis,Joint Custody,Dr. Dolittle 2,Dark Angel,I and I Am a Camera,Art Attack,Alex in Wonder,Diagnosis Murder,You Bet Your Life,Family Law,Separation,Providence,Big Night,The X-Files,Roadrunners,The West Wing,Lies, Damn Lies and Statistics,Dawson's Creek,To Green, with Love,The Drew Carey Show,Drew's Physical,Profiler,Reunion: Part 1,Inheritance,All in the Family,The Root of All Evil,American Pie,Mighty Joe Young,Very Bad Things,My Giant,Significant Others,The Next Big Thing,Ally McBeal,Body Language,Chicago Hope,The Lung and the Restless,Total Security,Pilot,The Maker,Trial and Error,Star Trek: Deep Space Nine,Ties Of Blood And Water,The Adversary,Second Skin,Dangerous Minds,Teach, Don't Touch,The Pretender,The Paper Clock,The Uninvited,She Cried No,The Sentinel,Vow of Silence,The Sunchaser,The Late Shift,A Case for Life,Dr. Quinn, Medicine Woman,Dead or Alive: Part 2,Dead or Alive: Part 1,Partners,How Was Your Date with Dad?,City Hall,All My Children,Episode dated 3 January 1996,The Client,The Burning of Atlanta,Whose Daughter Is She?,Angus,Law & Order,Cruel and Unusual,Apocrypha,Animal Instinct,NYPD Blue,Bombs Away,In the Butt, Bob,The Rockford Files: I Still Love L.A.,The Enemy Within,Birdland,Sons and Mudders,To My Daughter with Love,Murder, She Wrote,The Legacy of Borbey House,The Way to Dusty Death,My Johnny Lies Over the Ocean,L.A. Law,Testing, Testing, 1... 2... 3... 4,Doogie Howser, M.D.,What Makes Doogie Run,Eleven Angry People... and Vinnie,Dorky Housecall, M.D.,Love Makes the World Go 'Round... or Is It Money?,You've Come a Long Way, Babysitter,Show all 97 episodes,White Hot: The Mysterious Murder of Thelma Todd,Fire and Rain,Breaking Point,Moonlighting,Take My Wife, for Example,She Knows Too Much,Honor Bound,CBS Summer Playhouse,Baby on Board,St. Elsewhere,The Naked Civil Surgeon,Little Girl Lost,Matlock,The Genius,Diary of a Perfect Murder,Nine to Five,The Custody Fight,The Hanoi Hilton,CBS Schoolbreak Special,The Drug Knot,On Wings of Eagles,Part II,Part I,The Deliberate Stranger,The Magical World of Disney,A Fighting Choice,Hotel,Facades,Street Hawk,Pilot,For Love or Money,Victims for Victims: The Theresa Saldana Story,The Three Wishes of Billy Grier,The Red-Light Sting,Dynasty,The Voice: Part 2,The Vigil,Hill Street Blues,Here's Adventure, Here's Romance,The Winds of War,The Changing of the Guard,Of Love and War,Cry for the Strangers,The Love Boat,The Tomorrow Lady/Father, Dear Father/Still Life,Tucker's Witch,The Corpse Who Knew Too Much,Rehearsal for Murder,Hart to Hart,Harts and Fraud,Ladies' Man,The Committee,Games: Part 2,Games: Part 1,Women Need Not Apply,Think Young, Ladies,Show all 16 episodes,Darkroom,Stay Tuned, We'll Be Right Back,9 to 5,One Day at a Time,Teacher's Pet,Insight,Mr. and Mrs. Bliss,The Theft,United States,Broccoli,The Gathering, Part II,M*A*S*H,Are You Now, Margaret?,Walk Proud,Blind Ambition,Part IV,Part III,Part II,Part I,Stockard Channing in Just Friends,Lost Weekend,Pilot,Like Mom, Like Me,Mulligan's Stew,Winning the Big Ones,Ah, Wilderness,Little Grey Bird,A New Grandpa,Melinda Special,Show all 7 episodes,The Gathering,The Trial of Lee Harvey Oswald,The Streets of San Francisco,Breakup,Lanigan's Rabbi,In Hot Weather, the Crime Rate Soars,Man from Atlantis,Man from Atlantis,Police Woman,Father to the Man,Switch,Maggie's Hero,Barnaby Jones,Final Ransom,Dead Man's Run,Everybody Rides the Carousel,Rich Man, Poor Man,Part V: Chapter 7,Part IV: Chapter 6,Part III: Chapter 5,Part II: Chapters 3 and 4,Cannon,The Reformer,Killer on the Hill,The Bob Newhart Show,A Matter of Vice-Principal,Brutally Yours, Bob Hartley,McMillan & Wife,Requiem for a Bride,Till Death Do Us Part,The First 36 Hours of Dr. Durant,Caribe,The Survivor,Requiem for a Nun,Harry O,Silent Kill,The Man in the Glass Booth,The Crazy World of Julius Vrooder,Paper Moon,Long Division,The Wide World of Mystery,Murder by Proxy,Winter Kill,6 Rms Riv Vu,Owen Marshall, Counselor at Law,The Prowler,Who Saw Him Die?,Burden of Proof,Hawaii Five-O,Why Wait Till Uncle Kevin Dies?,Griff,All the Lonely People,Marcus Welby, M.D.,Blood Kin,Please Don't Send Flowers,Starring: Nancy Clancy,The Delphi Bureau,The Day of Justice Project,The Marcus-Nelson Murders,The Snoop Sisters,The Female Instinct,Bedtime Story,Young Marrieds at Play,The Mary Tyler Moore Show,The Six-and-a-Half-Year Itch,Shaft,Cannon,Making It,The F.B.I.,The Stalking Horse,The Governor & J.J.,Fawcett Is Running,The Edge of Night,In Good Company,The Man in the Glass Booth,Grandma,The Bannen Way,Unstoppable: Conversation with Melvin Van Peebles, Gordon Parks, and Ossie Davis,Face to Face with David,Episode #1.3,Near Myth: The Oskar Knight Story,American Pie: Beneath the Crust Vol. 1,David Dukes Memorial,The 16th Annual People's Choice Awards,America Undercover,Kids in Sports: The Price of Glory,Losin' It: Sex and the American Teenager,Missing Persons: Four True Stories,The Hellstrom Chronicle,Look Up and Live,The Celebrations, Part III: Leisure,The Celebrations, Part II: Love,The Celebrations, Part I: Work"
Felecia M. Bell,"Law & Order,Remains of the Day,Law & Order: Special Victims Unit,Fault,Smallville,Whisper,The Agency,French Kiss,JAG,Past Tense,Any Day Now,It's a Man's World,ER,The Miracle Worker,NightMan,Amazing Grace,Double Vision,Devil in Disguise,Hitchhiker,Bad to the Bone,Show all 22 episodes,NightMan,General Hospital,Episode #1.8633,Episode #1.8432,Episode #1.8427,Episode #1.8400,Episode #1.8399,Show all 7 episodes,Every Woman's Dream,Star Trek: Deep Space Nine,Shattered Mirror,Through The Looking Glass,Emissary,Me and the Boys,The Kiss-Off,Babyfever,Days of Our Lives,Episode #1.6815,Episode #1.6772,Episode #1.6771,Episode #1.6770,Episode #1.6749,Show all 43 episodes,Family Matters,Busted,The Great Los Angeles Earthquake,The Bold and the Beautiful,Episode #1.769,Hunter,Naked Justice: Part 1,What We Left Behind: Star Trek DS9"
Richard Beymer,"Twin Peaks,Part 17,Part 12,Part 10,Part 9,Part 7,Show all 6 episodes,Sadie's Waltz,Family Law,Against All Odds,Home the Horror Story,Profiler,Ceremony of Innocence,Playing Patti,Vengeance Unlimited,Noir,Elvis Meets Nixon,The X-Files,Sanguinarium,Foxfire,Flipper,Sharks,The Little Death,A Face to Die For,Murder, She Wrote,The Dark Side of the Door,Love & Hate in Cabot Cove,The Sound of Murder,The List of Yuri Lermentov,The Way to Dusty Death,Show all 6 episodes,The Disappearance of Kevin Johnson,State of Emergency,My Girl 2,Under Investigation,Star Trek: Deep Space Nine,The Siege,The Circle,The Homecoming,The Presence,Blackbelt,Twin Peaks,Episode #2.21,Episode #2.22,Episode #2.20,Episode #2.19,Episode #2.18,Show all 30 episodes,Silent Night, Deadly Night 3: Better Watch Out!,Buck James,Heal Thyself,Absalom, Absalom,The Bronx Zoo,The Gospel Truth,A Day Like Any Other,Dallas,Bedtime Stories,Moonlighting,All Creatures Great... and Not So Great,Generation,Paper Dolls,Episode #1.13,Episode #1.12,Episode #1.11,Episode #1.10,Episode #1.9,Show all 13 episodes,Cross Country,Insight,God in the Dock,Resurrection,Hunger Knows My Name,Somewhere Before,The Innerview,Scream Free!,Death Valley Days,Dress for a Desert Girl,The Telescope Eye,The Man from U.N.C.L.E.,The Survival School Affair,Dr. Kildare,Reckoning,New Doctor in Town,Strange Sort of Accident,Bob Hope Presents the Chrysler Theatre,Guilty or Not Guilty,The Virginian,Show Me a Hero,You Take the High Road,Kraft Suspense Theatre,The Easter Breach,The Stripper,The Longest Day,Hemingway's Adventures of a Young Man,Five Finger Exercise,Bachelor Flat,West Side Story,High Time,Playhouse 90,Dark December,The Diary of Anne Frank,Schlitz Playhouse,On the Brink,Jane Wyman Presents the Fireside Theatre,On the Brink,Sky King,Man Hunt,Whirlybirds,The Brothers,Navy Log,The Soapbox Kid,The Gray Ghost,An Eye for an Eye,The Danny Thomas Show,The Non-Orgs,Terry Has a Date,Zane Grey Theatre,The Bitter Land,26 Men,Dead Man in Tucson,Johnny Tremain,Cavalcade of America,Gentle Conqueror,So Big,Indiscretion of an American Wife,Fourteen Hours,Sandy Dreams,Behind the Red Curtain,I Had Bad Milk in Dehradun,Richard Beymer's Before... the Big Bang,It's a Beautiful World,Freedom Summer,The Passing of a Saint,Eyes on the Prize,Mississippi: Is This America?: 1962-1964,Safe Harbor,Josie,Insight,Hang Tight, Willy Bill,When Heroes Fall,The Trouble with Grandpa,A Step Too Slow,Who Loves Amy Tonight?,Show all 12 episodes,Leadfoot,The Juggler of Notre Dame,To Climb a Mountain,Girl on the Edge of Town,The Innerview,A Regular Bouquet: Mississippi Summer,Behind the Red Curtain,I Had Bad Milk in Dehradun,Richard Beymer's Before... the Big Bang,It's a Beautiful World,The Passing of a Saint,Josie,Insight,A Step Too Slow,This One for Dad,Blessed Be...,The Innerview,Behind the Red Curtain,I Had Bad Milk in Dehradun,Richard Beymer's Before... the Big Bang,It's a Beautiful World,The Passing of a Saint,The Innerview,A Regular Bouquet: Mississippi Summer,Insight,Clay Feet,Insight,Courage,High Powder,The Innerview,A Regular Bouquet: Mississippi Summer,American Experience,Freedom on My Mind,Twin Peaks,Episode #2.21,Josie,The Innerview,Secrets from Another Place: Creating Twin Peaks,An Introduction to David Lynch,American Experience,Freedom on My Mind,Richard Beymer's Before... the Big Bang,Richard Beymer discusses David Lynch's directing style,West Side Memories,An Introduction to David Lynch,Postcards From The Cast,Here's Hollywood,Episode #2.186,Episode #1.71,Hollywood Celebrity,post-production,20/20,Something's Coming: West Side Story,West Side Story - Bernsteins Broadway-Hit,Howard,EW Reunites,The Cast of Twin Peaks,Banda sonora,Episode #8.4,Gylne tider,Episode #4.2,San Sebastián 2005: Crónica de Carlos Boyero,Twin Peaks/Cop Rock: Behind the Scenes,The Magical World of Disney,Johnny Tremain: Part 2,Johnny Tremain: Part 1"
Camille Saviola,"Younger,Forever,Friends with Benefits,Girls on the Side,Sex, Liza and Rock & Roll,To Whom It May Concern,Staten Island Summer,Silent But Deadly,Nip/Tuck,Wesley Clovis,Entourage,One Car, Two Car, Red Car, Blue Car,Return to Queens Blvd,Aquamom,Without a Trace,Push Comes to Shove,Saving Grace,Are You an Indian Princess?,Standoff,Severance,Lez Be Friends,E-Ring,Pilot,Judging Amy,Getting Out,The Song That Never Ends,Lost and Found,ER,Twas the Night,First Monday,Family Secrets,Showdown,Strip Search,Unprotected Speech,Secrets and Lies,Show all 13 episodes,Some of My Best Friends,Pilot,The Marriage Counselor,Scenes from an Italian Party,JAG,Florida Straits,Becker,P.C. World,L.A. Doctors,Nate Expectations,Living Single,He's the One,Sunset Park,Star Trek: Deep Space Nine,Accession,The Collaborator,Battle Lines,Emissary,Mr. Wrong,NYPD Blue,Curt Russell,The West Side Waltz,Hope & Gloria,Love with an Improper Stranger,Salon, It's Been Good to Know You,Stuart Saves His Family,Friends,The One with the East German Laundry Detergent,Addams Family Values,Civil Wars,Captain Kangaroo Court,Denise and De Nuptials,Mob Psychology,The Heights,The Wanderer,Things That Go Bump in the Night,What Does It Take?,Splendor in the Past,No Place Like Home,Show all 7 episodes,L.A. Law,Christmas Stalking,Shadows and Fog,All I Want for Christmas,Queens Logic,Betsy's Wedding,How Much Is Really True?,Penn & Teller Get Killed,Baby Boom,When It Rains,Nightlife,Last Exit to Brooklyn,CBS Summer Playhouse,Sons of Gunz,Weekend Warriors,Remington Steele,Steele in the Chips,The Purple Rose of Cairo,Broadway Danny Rose,Jacobo Timerman: Prisoner Without a Name, Cell Without a Number,The Merv Griffin Show,Episode dated 26 July 1984,The Merv Griffin Show,Episode dated 26 July 1984"
