actor,movie_or_TV_name
Paul Dooley,"Capture the Flag,pre-production,Boy Makes Girl,post-production,In Limbo,completed,Saving Paradise,Selfie Dad,The Gesture and The Word,Modern Family,Dead on a Rival,Merry Happy Whatever,Merry Ex-Mas,Life in Pieces,Cabana Hero Action Son,Letter Promise Adult Seventy,The Kids Are Alright,Whales,Happy Cecil,The Love List,Little Cyst,Boxing,Show all 6 episodes,Bizaardvark,A Capella Problems,Pixar Short Films Collection 3,The Guest Book,Killer Party,Shameless,Weirdo Gallagher Vortex,Mo White!,The Good Doctor,22 Steps,Cars 3,Workaholics,Faux Chella,The Holy Man,Young & Hungry,Young & Matched,Young & Piggy,American Dad!,Next of Pin,Heartbeat,What Happens in Vegas... Happens,Childrens Hospital,Grandparents Day,The Skinny,Relapse,Other People,The Middle Ages,Comedy Bang! Bang!,Dax Shepard Wears a Heather Grey Shirt and Black Blazer,Tales from Radiator Springs,The Radiator Springs 500½,Spinning,Hiccups,Parenthood,Promises,Super Fun Night,Merry Super Fun Christmas,My Santa,Major Crimes,There's No Place Like Home,Turbo,Criminal Minds,All That Remains,Lifestyles of the Rich & Fabulous,Game Night,The Client List,Past Is Prologue,Hot in Cleveland,Claus, Tails & High-Pitched Males: Birthdates 3,Walter,Cars 2: The Video Game,Cars 2,Private Practice,Heaven Can Wait,Thanks,Ironmen,Huge,Parents' Weekend: Part II,Parents' Weekend: Part I,Birthdays,Poker Face,Spirit Quest,Show all 10 episodes,Better People,State of the Union,Episode #3.7,Scrubs,Our Histories,Cars Race-O-Rama,Sunday Afternoons,Horsemen,Bedtime Stories,Grey's Anatomy,Losing My Mind,Chronic Town,Drive Thru Confessions,Sunshine Cleaning,Cars Mater-National,Boston Legal,Hope and Gory,Side Order of Life,When Pigs Fly,Hairspray,7th Heaven,Small Miracles,Mater and the Ghostlight,For Your Consideration,Cars,The Jake Effect,The Intervention,Cars,Desperate Housewives,Coming Home,That's Good, That's Bad,The Sun Won't Set,Curb Your Enthusiasm,The Christ Nail,The Survivor,The Grand Opening,Mary, Joseph and Larry,The Baptism,Show all 7 episodes,Hopeless Pictures,Come Away Home,Adventures in Homeschooling,CSI: Crime Scene Investigation,Getting Off,ER,Blood Relations,Fire in the Belly,The Secret Sharer,And Baby Makes Two,Employee of the Month,Touch 'Em All McCall,Comfort and Joy,Nobody Knows Anything!,Becker,What's Love Got to Do with It?,Tracey Ullman in the Trailer Tales,Law & Order: Criminal Intent,Cherry Red,A Mighty Wind,The Practice,The Good Fight,Small Sacrifices,The Cradle Will Rock,Day in Court,Loser's Keepers,Show all 8 episodes,Insomnia,Once and Again,Chance of a Lifetime,Experience Is the Teacher,The Gay-Straight Alliance,Pictures,Destiny Turns on the Radio,Show all 6 episodes,The Perfect You,Recess Christmas: Miracle on Third Street,Rennie's Landing,A Woman's a Helluva Thing,The Huntress,Undercover,Jack & Jill,The Time/Sex Continuum,Kate Brasher,Jeff,The Geena Davis Show,Photo Finish,Providence,Saved by the Bell,Madison,Ally McBeal,Reasons to Believe,I'll Remember April,Special Delivery,Runaway Bride,Error in Judgment,Guinevere,Happy, Texas,Tracey Takes On...,Lies,Marriage,Dharma & Greg,Dharma & Greg on a Hot Tin Roof,Sleepwalkers,Passed Imperfect,The Wonderful World of Disney,Angels in the Endzone,Sabrina the Teenage Witch,A Doll's Story,Early Edition,Home,Telling Lies in America,Clockwatchers,Loved,Star Trek: Deep Space Nine,In Purgatory's Shadow,The Die Is Cast,Improbable Cause,The Wire,Duckman: Private Dick/Family Man,Dammit, Hollywood,Qiana,Millennium,The Well-Worn Lock,Grace Under Fire,Grace Tests Out,Redeeming Jimmy,Dating Buddies,You Go Girl,Take Me to Your Breeder,Show all 22 episodes,Waiting for Guffman,Ellen,Lobster Diary,High Society,Touching Up Your Roots,God's Lonely Man,Out There,The Underneath,The Computer Wore Tennis Shoes,Evolver,My So-Called Life,Self-Esteem,Father Figures,Sisters,Bombshell,Chicago Hope,Over the Rainbow,Dream On,The Courtship of Martin's Father,Steinway to Heaven,The Taking of Pablum 1-2-3: Part I,Brother of the Bride,Pop Secret,Show all 6 episodes,State of Emergency,The Mommies,The Old Man Cometh,The Traveling Poet,L.A. Law,Safe Sex,Tales from the Crypt,Forever Ambergris,The Boys,Ninety-Five in the Shade,A Dangerous Woman,My Boyfriend's Back,Tales of the City,Episode #1.5,Episode #1.4,Traveler's Rest,Frogs!,Mother of the Bride,Cooperstown,Room for Two,Dog Day Afternoons,The Ben Stiller Show,With Rob Morrow,With Colin Quinn,Perry Mason: The Case of the Heartbroken Bride,Mad About You,Paul in the Family,Batman: The Animated Series,It's Never Too Late,The Player,Mathnet,The Case of the Unnatural,Pros and Cons,Ho! Ho! Hold Up!,The Wonder Years,Soccer,Square One Television,Episode #4.4,Episode #4.2,Shakes the Clown,Sunday Dinner,My Dinner with Jack and Delores,My Life and Times,Our Wedding,White Hot: The Mysterious Murder of Thelma Todd,Coach,A Father and Son Reunion,Evening Shade,The Trials of Wood Newton,Guess Who's Coming for Christmas?,The Court-Martial of Jackie Robinson,Thirtysomething,Samurai Ad Man,The Go Between,Flashback,Coming of Age,Fever,Dick's Back,Daddy's Girl,Christmas at the Dunes,Boy Meets Girl,Show all 15 episodes,ALF,Break Up to Make Up,Something's Wrong with Me,I've Got a New Attitude,When He's Not a Stranger,Guts and Glory: The Rise and Fall of Oliver North,Lip Service,Last Rites,Superman 50th Anniversary,The Murder of Mary Phagan,Episode #1.2,Episode #1.1,The Golden Girls,Empty Nests,Love, Rose,Sesame Street,Episode #18.66,Bert meets Bertha,A New House in New Mexico,Episode #5.57,Monster in the Closet,Big Trouble,Tales from the Darkside,The Old Soft Shoe,O.C. and Stiggs,Stephen King's Golden Tales,Spenser: For Hire,Resurrection,The Steel Collar Man,CBS Schoolbreak Special,The Day the Senior Class Got Married,Sixteen Candles,The Wilder Summer,Faerie Tale Theatre,Hansel and Gretel,Rumpelstiltskin,Don't Eat the Pictures: Sesame Street at the Metropolitan Museum of Art,Going Berserk,The Firm,Pilot,Strange Brew,Kiss Me Goodbye,Endangered Species,American Playhouse,The Shady Hill Kidnapping,Jules Feiffer's Hold Me,Paternity,See China and Die,Popeye,Captain Kangaroo,Episode dated 28 August 1980,HealtH,Rich Kids,Breaking Away,A Perfect Couple,A Wedding,Simple Gifts,Raggedy Ann & Andy: A Musical Adventure,Slap Shot,Foreplay,Death Wish,The Dion Brothers,Great Performances,A Nice Place to Visit ..,,Up the Sandbox,The Corner Bar,Flanagan's Wake,The Night the Animals Talked,The Out of Towners,A Punt, a Pass, and a Prayer,Bewitched,Oedipus Hex,Get Smart,The Greatest Spy on Earth,Man in the Square Suit,The Defenders,Conflict of Interests,The Parisienne and the Prudes,East Side/West Side,No Hiding Place,The Middle Ages,Lifestyles of the Rich & Fabulous,HealtH,The Electric Company,2,Lifestyles of the Rich & Fabulous,Janeane from Des Moines,My So-Called Life: An Interview with Claire Danes,My So-Called Life: The Chase Family,Call the Usual Suspects: The Craft of the Character Actor,Little Shop of Horrors,Sills,post-production,Emily @ the Edge of Chaos,The Great Buster,Actors Entertainment,ActorsE Chat with Paul Dooley and Steve Nave,Moviegoer,Kevin Pollak's Chat Show,Paul Dooley/Winnie Holzman,25 Things You Didn't Know About Curb Your Enthusiasm,When the World Breaks,Celebrating Sixteen Candles,My So-Called Life: The Chase Family,The Ellen DeGeneres Show,Episode #5.34,Bob & Doug McKenzie's Two-Four Anniversary,The States,California, North Carolina, Kansas, New Hampshire, West Virginia,Call the Usual Suspects: The Craft of the Character Actor,A Wedding: Altman Style,Perspective on Altman's 'Perfect Couple',American Experience,John & Abigail Adams,E! True Hollywood Story,Sixteen Candles,Biography,Mia Farrow: A Life of Drama,An Evening at the Improv,Episode #15.11,The Merv Griffin Show,Carradines in Concert,Elaine Stritch, Paul Dooley, Bill Fiore, Gary Puckett, Frankie Howerd, Steve Rossi & Slappy White, Dr. Cleo Dawson,Zsa Zsa Gabor, Jerry Vale, Paul Dooley, Jose Molina,Eva Gabor, Peggy Cass, Julius LaRosa, Paul Dooley, the Amazing Kreskin,Ginger Rogers, Hermione Gingold, Dave Astor, Paul Dooley, Irene Dalis, Dr. Howard Rusk,Good Morning America,Episode dated 28 August 1979,The Dom DeLuise Show,Episode #1.16,Episode #1.15,Episode #1.12,Episode #1.9,Episode #1.8,Show all 9 episodes,The Jack Paar Program,Episode #2.21,The Garry Moore Show,Shani Wallis, Nancy Walker, Allen & Rossi,The Ed Sullivan Show,Hank Williams, Jr., Janet Blair, Jerry Vale, The Kim Sisters,Buster Keaton, Teresa Brewer, Tessie O'Shea, George Kirby, Frank Ifield, John Huston, Paul Dooley & Richard Libertini, The Burke Family, Rene Lavand, Hugh Forgie, Topo Gigio,The Tonight Show,Episode dated 15 August 1962,Episode #1.67,The Tonight Show Starring Jack Paar,Episode #5.209,Episode #2.77,Altman,Curb Your Enthusiasm,The End,Grace Under Fire,Grace's New Job"
Duncan Regehr,"Trek Untold,Duncan Regehr, The Sex-Candle Ghost from ""Star Trek TNG"" and Shakaar on DS9,The Strange Case of DJ Cosmic,The Good Times Are Killing Me,Nightmare at the End of the Hall,Presumed Dead,Secret Lives,Body & Soul,Flying Virus,Air Bud 3,Blood Surf,Murder, She Wrote: A Story to Die For,Fast Track,The Temptation of Beckett,Change of Heart,Deconstructing Eagle Ridge,Guys with Guns,Jeff's Back,Show all 22 episodes,Star Trek: Deep Space Nine,The Begotten,Crossfire,Shakaar,The Haunting of Lisa,Cybill,To Sir, with Lust,Timemaster,Robin's Hoods,Seems Like Old Times,Once in a Lifetime,Star Trek: The Next Generation,Sub Rosa,Moon Over Miami,Cinderello,Zorro,The Discovery,Conundrum,Death & Taxes,The Arrival,My Word Is My Bond,Show all 88 episodes,Primo Baby,The Last Samurai,The Banker,Billy the Kid,Shades of Love: Little White Lies,Alfred Hitchcock Presents,If Looks Could Kill,The Magical World of Disney,Earth Star Voyager: Part 2,Earth Star Voyager: Part 1,The Monster Squad,Hotel,Shadows of Doubt: Part 2,Shadows of Doubt: Part 1,The Adventures of Alexander Hawkins,V,The Rescue,The Betrayal,The Hero,The Conversion,My Wicked, Wicked Ways: The Legend of Errol Flynn,The Last Days of Pompeii,Part 3,Part 2,Part 1,Wizards and Warriors,Vulkar's Revenge,The Dungeon of Death,The Caverns of Chaos,Skies of Death,Night of Terror,Show all 8 episodes,The Blue and the Gray,Part 3,Part 2,Part 1,Goliath Awaits,Episode #1.2,Episode #1.1,The Greatest American Hero,The Best Desk Scenario,Matt and Jenny,Wagon Train West,The Highlanders,Mystery of the Pikes,The Actress,A Woman's Place,Show all 26 episodes,The Donnellys of Biddulph,The War Is Over,A Cosmic Christmas,The Newcomers,Secret Lives,Zorro,Silk Purses and Sow's Ears,The 7th Rule,Episode #1.100,500,Wolfman's Got Nards,Cinemassacre's Monster Madness,Monster Squad,Monster Squad Forever!,Saving the Endangered Species,Dog Wars,How William Shatner Changed the World,Zorro: A Conspiracy of Blood,Zorro: The Legend Begins,Joe Bob's Drive-In Theater,Episode dated 16 July 1994"
Christopher J. Marcinko,"Boston Legal,Schadenfreude,House,Three Stories,Dawson's Creek,Castaways,The West Wing,Two Cathedrals,Star Trek: Deep Space Nine,What You Leave Behind,Spin City,Mayor Over Miami,Walker, Texas Ranger,Higher Power,Quantum Leap,Mirror Image - August 8, 1953,21 Jump Street,I'm Okay, You Need Work"
Robbin L. Slocum,"Star Trek: Deep Space Nine,The Dogs Of War,Extreme Measures,Tacking Into The Wind,When It Rains...,The Changing Face of Evil,Show all 96 episodes,Violated,Star Trek: Deep Space Nine,What You Leave Behind,Star Trek: Deep Space Nine,Ties Of Blood And Water"
Elle Alexander,"Everything Everywhere All at Once,completed,The Laundromat,Fuller House,It's Always Open,Single Parents,The Beast,S.W.A.T.,Never Again,Young Sheldon,Seven Deadly Sins and a Small Carl Sagan,Lodge 49,Sunday,Astro,All Night,Jello Wrestling,Game Shakers,Super Ugly Head,Escape from Utah!,Freakish,Trespass,The Goldbergs,Deadheads,Couples Costume,School of Rock,Don't Let Me Be Misunderstood,Angie Tribeca,Fleas Don't Kill Me,Battle Creek,Sympathy for the Devil,Stockholm,I Really Hate My Ex,Glee,2009,The Haves and the Have Nots,A Southern Brawl,The War Room,Maggie's Plan,Selfie,I Woke Up Like This,Un-Tag My Heart,Scandal,Where the Sun Don't Shine,Conan,Ashton Kutcher/Krysten Ritter/Beck,The Lonely Life of Albert Peniseyebrows,Alexander and the Terrible, Horrible, No Good, Very Bad Day,You're the Worst,Salem,The Red Rose and the Briar,Lies,Grimm,Once We Were Gods,Untitled Bounty Hunter Project,Vamps,The Exes,Shall We Dance,True Blood,Whatever I Am, You Made Me,Shameless,Parenthood,Can I Have a Mother,I'll Light a Candle for You Every Day,The Suite Life on Deck,Graduation on Deck,Paul,You Again,Miss Nobody,Zombieland,The Cleaner,Path of Least Resistance,iCarly,iMake Sam Girlier,Chocolate News,Episode #1.1,Fleece,Superhero Movie,My Name Is Earl,Bad Earl,Numb3rs,Graphic,The Wedding Bells,Partly Cloudy, with a Chance of Disaster,Zoey 101,Zoey's Balloon,The Great Vince Blake,The Play,Heroes,Chapter Sixteen 'Unexpected',Ned's Declassified School Survival Guide,The Bus & Bad Hair Days,Passions,Episode #1.1839,Her Knight,Jeepers Creepers 2,BachelorMan,Bringing Down the House,She Spies,While You Were Out,Perilyzed,Confidence,Worst Case Scenarios,Laurel Canyon,Impostor,Crossing Jordan,Jeepers Creepers,WOW Unleashed,Women of Wrestling,Gentleman B.,The Flintstones in Viva Rock Vegas,The Convent,Man on the Moon,Justice,Enemy of the State,One World,BASEketball,Twilight,It's a Miracle,Mousehunt,High Incident,Hot Wire,Till Death Do Us Part,Silk Stalkings,Till Death Do Us Part,JAG,The Bold and the Beautiful,Episode #1.1951,Euphoria,You Who Cannot See, Think of Those Who Can,Astro,Game Shakers,Super Ugly Head,Escape from Utah!,Slingshot,School of Rock,Don't Let Me Be Misunderstood,Club Santino,A to Z,H Is for Hostile Takeover,Conan,Ashton Kutcher/Krysten Ritter/Beck,The Lonely Life of Albert Peniseyebrows,Scandal,30,Bucket and Skinner's Epic Adventures,Epic Crashers,Shooting Gallery,Zombieland,Passions,Episode #1.1188,Episode #1.1141,Episode #1.1140,Episode #1.966,She Spies,Leotards and Lies,While You Were Out,Perilyzed,JAG,Touchdown,Crossing Jordan,Sunset Division,Confidence,Women vs. Men,Women of Wrestling,Episode #1.16,Episode #1.11,Episode #1.4,Episode #1.3,One World,Crushed,Star Trek: Voyager,Imperfection,Hope And Fear,Favorite Son,Blood Fever,Gentleman B.,The Convent,Star Trek: Deep Space Nine,The Dogs Of War,Take Me Out To The Holosuite,Nor The Battle To The Strong,Apocalypse Rising,Worst Case Scenarios,Worst Case Scenario,WOW Unleashed"
Ann Gillespie,"90210,To Thine Own Self Be True,A Trip to the Moon,Wild Alaskan Salmon,Environmental Hazards,Off the Rails,Show all 6 episodes,Judging Amy,Off the Grid,First Years,The First Thing You Do...,Gilmore Girls,Paris Is Burning,Beverly Hills, 90210,Ode to Joy,What's in a Name,Family Tree,The Following Options,I'm Back Because,Show all 55 episodes,Diagnosis Murder,Santa Claude,Katie Joplin,I'd Rather Be in Philadelphia,The Practice,Home Invasions,Sunset Beach,Episode #1.566,Episode #1.565,Valerie Flake,ER,They Treat Horses, Don't They?,Archibald the Rainbow Painter,7th Heaven,Do Something,Star Trek: Deep Space Nine,Distant Voices,Life Support,The Wire,Babel,The Gambler Returns: The Luck of the Draw,Rich Girl,Cop Rock,Ill-Gotten Gaines,By Dawn's Early Light,Hunter,Sudden Withdrawal,Star Trek: The Next Generation,Pen Pals,Hard Time on Planet Earth,Stranger in a Strange Land,Matlock,The Network,Kenny Rogers as The Gambler, Part III: The Legend Continues,My Two Dads,Soho's by You?,Mary,Everyone's a Critic,The Sheriff and the Astronaut,Happy Days,Fonzie Moves Out,Hotel,Mistaken Identities,Kenny Rogers as The Gambler: The Adventure Continues,Amanda's,My Cheatin' Staff,Living Proof: The Hank Williams, Jr. Story,T.J. Hooker,Raw Deal,Lovesick,Ryan's Hope,Episode #1.1778,Episode #1.1776,Episode #1.1773,Episode dated 18 March 1982,Episode #1.1685,Show all 147 episodes,Parole,Kent State,Beverly Hills, 90210,A Walsh Family Christmas,Entertainment Tonight,Episode dated 27 August 2008"
Ray Petersen,"Star Trek: Deep Space Nine,Inter Arma Enim Silent Leges,Civil Wars,The Naked and the Wed,The Colbys,All Fall Down,Bloodlines,Something Old, Something New,Dynasty,Focus,The Trial: Part 1,Ben,The Titans: Part 1,The Aftermath,Show all 8 episodes"
Tom Hand,"Tyrone,Star Trek: Deep Space Nine,Extreme Measures,Scream 2,I'll Fly Away: Then and Now,Kalifornia"
Chris Kelly,"Girl with a Pearl Earring,Tom Stone,For the Money: Part 1,For the Money: Part 2,Turning Paige,Four Jacks,Joseph 2000,Star Trek: Deep Space Nine,Field Of Fire,Water Rats,Epiphany"
J.A. Popovec,"Turn of Faith,Felicity,Miss Conception,Man on the Moon,Star Trek: Deep Space Nine,Badda-Bing, Badda-Bang,The Magnificent Seven,Sins of the Past,The New Law,The Master of Disguise"
Shay Brown,"Beautiful Something,Thrust,Abby,Bring It Arm!,Succubus,Passions,Episode #1.1055,Episode #1.1054,Days of Our Lives,Episode #1.9531,Episode #1.9527,When Cupid Dances...,Star Trek: Deep Space Nine,Extreme Measures,RollerJam,Letter to My Mother,Bring It Arm!"
Rico Bueno,"Maron,Dead Possum,Mr. Sunshine,Pilot,Sex Drugs Guns,The Real Deal,Party Down,Pepper McMasters Singles Seminar,The Shield,Playing Tight,The Handler,Big Stones,Punch-Drunk Love,Little Nicky,Star Trek: Deep Space Nine,Inter Arma Enim Silent Leges,Star Trek: Insurrection,How They Get There,Alien: Resurrection,Boogie Nights,Dark Secrets,Illegal Entry: Formula for Fear,And the Band Played On,Poetic Justice,Actors Entertainment,Tinsel on the Town: SAG All-Industry Holiday Party,The Work of Director Spike Jonze"
Hans Beimler,"The Middleman,The Palindrome Reversal Palindrome,The Clotharian Contamination Protocol,The Vampiric Puppet Lamentation,The Obsolescent Cryogenic Meltdown,The Ectoplasmic Panhellenic Investigation,Show all 11 episodes,The Dresden Files,Second City,What About Bob?,Things That Go Bump,The Other Dick,Storm Front,Show all 13 episodes,Fawlty Tower Oxnard,The Wedding Party,Hotel Inspectors,Basil the Rat,The District,Fools Russian: Part 2,Fools Russian: Part 1,Don't Fence Me In,Running Towards Fire,The Agony and the Ecstasy,Show all 22 episodes,Profiler,Tsuris,On Your Marks,Pianissimo,Mea Culpa,House of Cards,Show all 20 episodes,Star Trek: Deep Space Nine,What You Leave Behind,The Dogs Of War,Extreme Measures,Tacking Into The Wind,When It Rains...,Show all 101 episodes,TekWar,TekWar,Beyond Reality,Killer Instinct,Asylum,Black Magic,The Bridge,The Cold,Show all 12 episodes,Star Trek: The Next Generation,The Best of Both Worlds,Transfigurations,Ménage à Troi,Sarek,The Most Toys,Show all 26 episodes,Riverworld,The Middleman,The Cursed Tuba Contingency,The Dresden Files,Second City,What About Bob?,Things That Go Bump,The Other Dick,Storm Front,Show all 13 episodes,Fawlty Tower Oxnard,Communication Problems,The Wedding Party,Basil the Rat,Scarlett,The Twilight Zone,The Pool Guy,The Chronicle,A Snitch in Time,Tears of a Clone,The District,Fools Russian: Part 2,The D.C. Strangler,The Santa Wars,Worst Block,Profiler,Proteus,Clean Sweep,Reunion: Part 2,Star Trek: Deep Space Nine,What You Leave Behind,The Changing Face of Evil,Badda-Bing, Badda-Bang,The Emperor's New Cloak,The Siege Of AR-558,Show all 26 episodes,TekWar,Cyberhunt,Tek Posse,Sellout,Exosquad,The Night of the Traitor,Dragon's Rock,Space Precinct,Time to Kill,Beyond Reality,The Bridge,She-Wolf of London,Eclipse,Star Trek: The Next Generation,Allegiance,Yesterday's Enterprise,Who Watches The Watchers,Shades of Gray,The Emissary,Show all 15 episodes,Knightwatch,Cops: Part 1,Knight Before Christmas,Friday Knight,Once a Hero,Remember the Cottonwood,Manos Arriba Mrs. Greely,Fame,Best Buddies,The Crimson Blade,All Talking, All Singing, All Dancing,Shadow Chasers,The Many Lives of Jonathan,Fame,Baby, Remember My Name,Alice Doesn't Work Here Anymore,Of Cabbages and Kings,Reggie and Rose,The Lounge Singer Who Knew Too Much,Show all 24 episodes,The Golden Child,Crossings,Episode #1.3,Episode #1.2,Episode #1.1,Cocoon,Mischief,Splash,The Four Seasons,Backseat Drivers,Night Shift,Star Trek: The Next Generation,Shades of Gray,Peak Performance,The Emissary,Up The Long Ladder,Samaritan Snare,Show all 7 episodes,Haraka,Fawlty Tower Oxnard,Communication Problems,Basil the Rat,TekWar,Skin Deep,Star Trek: Deep Space Nine,What You Leave Behind,What We Left Behind: Star Trek DS9"
Bradley Thompson,"For All Mankind,The Grey,Triage,And Here's to You,Don't Be Cruel,Best-Laid Plans,Show all 20 episodes,Falling Water,The Art of the Deal,Risk Assessment,Nothing Personal,Love Is a Dreamer,Mothers, Fathers, Daughters, Sons,Show all 10 episodes,The Strain,The Last Stand,The Traitor,Extraction,Ouroboros,Tainted Love,Show all 43 episodes,Crossing the Line,Falling Skies,Brazil,Journey to Xibalba,Strange Brew,The Pickett Line,Be Silent and Come Out,Show all 20 episodes,Defiance,The Serpent's Egg,Pilot, Part 1,Battlestar Galactica: Blood & Chrome,Alphas,The Unusual Suspects,Blind Spot,A Short Time in Paradise,Catch and Release,CSI: Crime Scene Investigation,In a Dark, Dark House,Cello and Goodbye,Father of the Bride,Unleashed,Hitting for the Cycle,Show all 65 episodes,Battlestar Galactica,Daybreak: Part 2,Daybreak: Part 1,Islanded in a Stream of Stars,Someone to Watch Over Me,Deadlock,Show all 60 episodes,Battlestar Galactica: Razor,Battlestar Galactica: Razor Flashbacks,Escape,Survivors,The Lab,Free Fall,Operation Raptor Talon,Show all 7 episodes,Battlestar Galactica: The Resistance,Webisode 10,Webisode 9,Webisode 8,Webisode 7,Webisode 6,Show all 10 episodes,For All Mankind,Triage,Pathfinder,Bent Bird,Into the Abyss,Falling Water,The Art of the Deal,Watchers,The Strain,The Traitor,One Shot,Do or Die,The Battle of Central Park,Bad White,Show all 11 episodes,The Strain: Webisodes,Under Siege,Crossing the Line,Falling Skies,Saturday Night Massacre,Journey to Xibalba,Be Silent and Come Out,Collateral Damage,A More Perfect Union,Show all 7 episodes,Defiance,The Serpent's Egg,Aliens: Colonial Marines,Battlestar Galactica: Blood & Chrome,CSI: Crime Scene Investigation,Targets of Obsession,Fracked,Shock Waves,Irradiator,The Lost Girls,Show all 9 episodes,Battlestar Galactica,Someone to Watch Over Me,Sometimes a Great Notion,Revelations,He That Believeth in Me,Maelstrom,Show all 26 episodes,Battlestar Galactica: The Resistance,Webisode 10,Webisode 9,Webisode 8,Webisode 7,Webisode 6,Show all 10 episodes,The Twilight Zone,Homecoming,Fair Warning,Harsh Mistress,Night Visions,Reunion/Neighborhood Watch,The Fearing Mind,Call of the Wild,Upgrade,Star Trek: Deep Space Nine,What You Leave Behind,The Dogs Of War,Extreme Measures,Tacking Into The Wind,When It Rains...,Show all 40 episodes,Ghost Stories,Beware the Muse,Back Ward,My Brother Is Afraid of Just About Everything,Star Trek: Deep Space Nine,Change Of Heart,Honor Among Thieves,One Little Ship,Far Beyond The Stars,Who Mourns For Morn?,Show all 16 episodes,Battlestar Galactica,Someone to Watch Over Me,Star Trek: Deep Space Nine,What You Leave Behind,Fire in the Middle,The Music of 'Battlestar Galactica',Battlestar Galactica: Behind the Scenes - The Writers Office"
Lolita Fatjo,"What We Left Behind: Star Trek DS9,Star Trek: Voyager,Unimatrix Zero,The Haunting Of Deck Twelve,Life Line,Fury,Muse,Show all 109 episodes,Star Trek: Deep Space Nine,The Dogs Of War,Tacking Into The Wind,When It Rains...,The Changing Face of Evil,Strange Bedfellows,Show all 160 episodes,Star Trek: First Contact,Star Trek: The Next Generation,All Good Things...,Preemptive Strike,Emergence,Bloodlines,Firstborn,Show all 51 episodes,Star Trek: Deep Space Nine,What You Leave Behind,Starship Excelsior,Tomorrow's Excelsior,Chaos on the Bridge,Get a Life!,What We Left Behind: Star Trek DS9,Star Trek: The Next Generation - The Sky's the Limit - The Eclipse of Star Trek: The Next Generation,Chaos on the Bridge,Relativity: The Family Saga of Star Trek - The Next Generation,Trekkies 2"
